{
  "node_id": "profession.vanshawali.default",
  "node_type": "profile",
  "owner": "user.default",
  "permissions": {
    "read": ["user.default", "family.circle"],
    "write": ["user.default"],
    "execute": ["user.default", "system"]
  },
  "ui_schema": {
    "component": "ProfessionCard",
    "layout": "form"
  },
  "data": {
    "occupation": "",
    "company_name": "",
    "role": "",
    "experience_years": null,
    "industry": "",
    "skills": [],
    "certifications": [],
    "income_range": ""
  },
  "actions": [
    {
      "name": "log-profession-updated",
      "type": "emit_log"
    }
  ],
  "children": [],
  "logs": [],
  "state_hash": "",
  "version": 1
}
