{
  "node_id": "bank_account.dravyam.default",
  "node_type": "wallet",
  "owner": "user.default",
  "permissions": {
    "read": ["user.default", "system"],
    "write": ["system"],
    "execute": ["system"]
  },
  "ui_schema": {
    "component": "BankAccountCard",
    "layout": "masked-list"
  },
  "data": {
    "accounts": [
      {
        "account_id": "",
        "bank_name": "",
        "account_number_masked": "",
        "ifsc": "",
        "upi_id": "",
        "verified": false,
        "is_primary": false
      }
    ]
  },
  "actions": [
    {
      "name": "log-bank-linked",
      "type": "emit_log"
    }
  ],
  "children": [],
  "logs": [],
  "state_hash": "",
  "version": 1
}
