{
  "node_id": "contact.vanshawali.default",
  "node_type": "profile",
  "owner": "user.default",
  "permissions": {
    "read": ["user.default"],
    "write": ["user.default"],
    "execute": ["user.default", "system"]
  },
  "ui_schema": {
    "component": "ContactCard",
    "layout": "form"
  },
  "data": {
    "phone": {
      "value": "",
      "privacy": "family"
    },
    "email": {
      "value": "",
      "privacy": "private"
    },
    "whatsapp": {
      "value": "",
      "privacy": "friends"
    },
    "telegram_id": {
      "value": "",
      "privacy": "public"
    },
    "emergency_contact": {
      "name": "",
      "phone": "",
      "relation": "",
      "privacy": "family"
    },
    "alternate_contact": {
      "value": "",
      "privacy": "family"
    }
  },
  "actions": [
    {
      "name": "log-contact-updated",
      "type": "emit_log"
    }
  ],
  "children": [],
  "logs": [],
  "state_hash": "",
  "version": 1
}
