{
  "node_id": "ledger.dravyam.default",
  "node_type": "data",
  "owner": "system",
  "permissions": {
    "read": ["user.default", "system"],
    "write": ["system"],
    "execute": ["system"]
  },
  "ui_schema": {
    "component": "LedgerTable",
    "layout": "immutable-list"
  },
  "data": {
    "entries": [],
    "total_debits": {},
    "total_credits": {}
  },
  "actions": [],
  "children": [],
  "logs": [],
  "state_hash": "",
  "version": 1
}
