{
  "node_id": "family.vanshawali.default",
  "node_type": "relation",
  "owner": "user.default",
  "permissions": {
    "read": ["user.default", "family.circle"],
    "write": ["user.default"],
    "execute": ["user.default", "system"]
  },
  "ui_schema": {
    "component": "FamilyGraphCard",
    "layout": "tree"
  },
  "data": {
    "members": [
      {
        "member_id": "",
        "relation": "",
        "name": "",
        "age": null,
        "profession": "",
        "education": "",
        "contact": "",
        "location": "",
        "node_ref": null,
        "child_info": {
          "school": "",
          "class": "",
          "board": "",
          "subjects": []
        }
      }
    ],
    "relation_types": [
      "father", "mother", "spouse", "son", "daughter",
      "grandfather", "grandmother", "brother", "sister",
      "uncle", "aunt", "cousin", "extended"
    ]
  },
  "actions": [
    {
      "name": "log-family-updated",
      "type": "emit_log"
    }
  ],
  "children": [],
  "logs": [],
  "state_hash": "",
  "version": 1
}
